{
  "integration_descriptor_version": "1",
  "id": "org.seedspec.fixtures.example-context-integration",
  "version": "1.0.0",
  "name": "Example Context Integration",
  "description": "Exercises metadata discovery, native validation, preparation, and bridge fallback.",
  "license": "Apache-2.0",
  "formats": [
    {
      "id": "org.example.context.behavior",
      "versions": ["1.0.0"],
      "entrypoints": ["BEHAVIOR.md"]
    }
  ],
  "adapter": {
    "id": "org.seedspec.fixtures.example-context-adapter",
    "version": "1.0.0",
    "adapter_api_version": "1",
    "entrypoint": "adapter.mjs",
    "digest": "sha256:5134fc271f2f4add10105cc9e1468154a1cf1591e9836115aec1d8b64137b7da",
    "capabilities": ["inspect", "validate", "prepare"]
  },
  "bridges": [
    {
      "id": "review-behavior",
      "description": "Interpret the example Behavior through a portable Skill.",
      "path": "bridges/review-behavior/",
      "entrypoint": "SKILL.md",
      "digest": "sha256:6270a702e03be43cd22399397d295a24276ff1ed1dd864d7d1a59b4cacae23f4",
      "formats": ["org.example.context.behavior"],
      "default": true,
      "applies_to": {
        "purposes": ["review", "evaluate"],
        "audiences": ["reviewer", "evaluator"]
      }
    }
  ]
}
